{
  "evidence_type": "khu.research.gpu_shape_evidence",
  "schema_version": "0.2.0",
  "evidence_id": "sha256:71c49d9217297203f3bcfc2831049144071d8eebd6b65d4a50bcb48b1b853c7b",
  "request_sha256": "7a14f7c6da86aebd2015012eca3685fce81fd924e661e79ea8649f6ffe91fe7f",
  "generated_at": "2026-09-28T19:46:08.278489Z",
  "status": "RESEARCH_ESTIMATE",
  "scope": {
    "kind": "same_host_batch_benchmark_prediction",
    "calibration": "uncalibrated_point_estimate",
    "deployment_authority": false
  },
  "provenance": {
    "model_artifact_sha256": "7a934da440ea0c7473e4e59eb5fa0c8c57f347389272bd303cb0051ef918b161",
    "training_extract_parquet_sha256": "b7bba7963e8a309b6a8502a1d98eefb150476b1381ec016beeb68cbf63fae906",
    "artifact_hash_check": "assessor_reported_verified_at_load",
    "training_sklearn_version": "1.6.1",
    "runtime_sklearn_version": "1.6.1",
    "split_manifest_sha256": "817ccd79e180e0373db085ac254698b26c258b060aea633bcc73c621f86648f8",
    "support_index_check": "verified_snapshot_and_manifest"
  },
  "workload": {
    "application_id": "research-demo-bert-l2",
    "workload_id": "783f9cfdcd98f2b1017e1329e7130ca0a35064f0f9fbcd583364ccf624e31d55",
    "model_id": "google/bert_uncased_L-2_H-128_A-2",
    "model_revision": "30b0a37ccaaa32f332884b96992754e246e48c5f",
    "device": "cuda",
    "host": "icns",
    "device_name": "NVIDIA RTX PRO 5000 Blackwell",
    "batch_size": 1,
    "max_length": 32,
    "request_concurrency": 1,
    "repeats": 8
  },
  "benchmark_objective": {
    "batch_latency_p95_limit_ms": 3.0,
    "min_requests_per_second": 600.0,
    "source": {
      "kind": "research_demo",
      "reference": "research/examples/gpu_shape_request.json"
    }
  },
  "selection_rule": "min_gpu_replicas_then_cpu_affinity_cores",
  "candidates": [
    {
      "gpu_replicas": 1,
      "cpu_affinity_cores": 2,
      "cpu_threads": 2,
      "status": "PREDICTED",
      "predicted_batch_latency_p95_ms": 1.923522978551211,
      "predicted_requests_per_second": 538.2368390898409,
      "batch_latency_margin_ms": 1.076477021448789,
      "requests_per_second_margin": -61.76316091015906,
      "meets_estimated_benchmark_objective": false,
      "gpu_indices": [
        0
      ]
    },
    {
      "gpu_replicas": 1,
      "cpu_affinity_cores": 4,
      "cpu_threads": 4,
      "status": "PREDICTED",
      "predicted_batch_latency_p95_ms": 1.923522978551211,
      "predicted_requests_per_second": 538.2368390898409,
      "batch_latency_margin_ms": 1.076477021448789,
      "requests_per_second_margin": -61.76316091015906,
      "meets_estimated_benchmark_objective": false,
      "gpu_indices": [
        0
      ]
    },
    {
      "gpu_replicas": 1,
      "cpu_affinity_cores": 8,
      "cpu_threads": 8,
      "status": "PREDICTED",
      "predicted_batch_latency_p95_ms": 1.908361176522516,
      "predicted_requests_per_second": 540.297019016447,
      "batch_latency_margin_ms": 1.091638823477484,
      "requests_per_second_margin": -59.70298098355295,
      "meets_estimated_benchmark_objective": false,
      "gpu_indices": [
        0
      ]
    },
    {
      "gpu_replicas": 1,
      "cpu_affinity_cores": 16,
      "cpu_threads": 16,
      "status": "PREDICTED",
      "predicted_batch_latency_p95_ms": 1.908361176522516,
      "predicted_requests_per_second": 540.297019016447,
      "batch_latency_margin_ms": 1.091638823477484,
      "requests_per_second_margin": -59.70298098355295,
      "meets_estimated_benchmark_objective": false,
      "gpu_indices": [
        0
      ]
    },
    {
      "gpu_replicas": 2,
      "cpu_affinity_cores": 2,
      "cpu_threads": 2,
      "status": "PREDICTED",
      "predicted_batch_latency_p95_ms": 2.029383056002796,
      "predicted_requests_per_second": 1022.3130050640893,
      "batch_latency_margin_ms": 0.9706169439972041,
      "requests_per_second_margin": 422.31300506408934,
      "meets_estimated_benchmark_objective": true,
      "gpu_indices": [
        0,
        1
      ]
    },
    {
      "gpu_replicas": 2,
      "cpu_affinity_cores": 4,
      "cpu_threads": 4,
      "status": "PREDICTED",
      "predicted_batch_latency_p95_ms": 2.029383056002796,
      "predicted_requests_per_second": 1022.3130050640893,
      "batch_latency_margin_ms": 0.9706169439972041,
      "requests_per_second_margin": 422.31300506408934,
      "meets_estimated_benchmark_objective": true,
      "gpu_indices": [
        0,
        1
      ]
    },
    {
      "gpu_replicas": 2,
      "cpu_affinity_cores": 8,
      "cpu_threads": 8,
      "status": "PREDICTED",
      "predicted_batch_latency_p95_ms": 2.02376091865608,
      "predicted_requests_per_second": 1031.8500901376858,
      "batch_latency_margin_ms": 0.9762390813439201,
      "requests_per_second_margin": 431.8500901376858,
      "meets_estimated_benchmark_objective": true,
      "gpu_indices": [
        0,
        1
      ]
    },
    {
      "gpu_replicas": 2,
      "cpu_affinity_cores": 16,
      "cpu_threads": 16,
      "status": "PREDICTED",
      "predicted_batch_latency_p95_ms": 2.02376091865608,
      "predicted_requests_per_second": 1031.8500901376858,
      "batch_latency_margin_ms": 0.9762390813439201,
      "requests_per_second_margin": 431.8500901376858,
      "meets_estimated_benchmark_objective": true,
      "gpu_indices": [
        0,
        1
      ]
    }
  ],
  "selected_shape": {
    "gpu_replicas": 2,
    "cpu_affinity_cores": 2,
    "gpu_indices": [
      0,
      1
    ]
  },
  "support_relation": {
    "partition": "train",
    "feature_tuple_sha256": "7d4ea7ab1f23b6777f43f41d347888ab500062283d629f6faef58f64a269c1fb",
    "basis": "exact_workload_input_tuple_in_verified_tracked_campaigns",
    "independent_performance_proof": false
  }
}
